{
  "ok": true,
  "artifact_type": "capability-first-release-audit",
  "generated_at": "2026-08-13T15:52:32.819Z",
  "project_root": "/Users/mn/development/ai-organization-framework-public",
  "summary": {
    "capability_count": 27,
    "delta_count": 1,
    "new_capability_count": 1,
    "updated_capability_count": 0,
    "removed_capability_count": 0,
    "failing_check_count": 0
  },
  "capabilities": [
    {
      "capability_id": "PCAP-TRACEABILITY",
      "name": "Traceability",
      "user_value": "Users can reconstruct why work exists and what evidence supports it without reading every raw artifact.",
      "first_version": "v7.0.0",
      "status": "available"
    },
    {
      "capability_id": "PCAP-ORGANIZATION-MEMORY",
      "name": "Organization Memory",
      "user_value": "Users can continue governed work across sessions instead of relying on one long chat transcript.",
      "first_version": "v7.1.0",
      "status": "available"
    },
    {
      "capability_id": "PCAP-GOVERNANCE",
      "name": "Governance",
      "user_value": "Users can stop work from being called done only because the maker says it is done.",
      "first_version": "v6.4.0",
      "status": "available"
    },
    {
      "capability_id": "PCAP-HUMAN-APPROVAL",
      "name": "Human Approval",
      "user_value": "Users can distinguish Council review from explicit human permission before external side effects.",
      "first_version": "v8.7.0",
      "status": "available"
    },
    {
      "capability_id": "PCAP-EXTERNAL-RESOURCE-ACCESS",
      "name": "External Resource Access",
      "user_value": "Users can see what external resource is being used, for what purpose, and under what limits.",
      "first_version": "v8.0.0",
      "status": "available"
    },
    {
      "capability_id": "PCAP-PROVIDER-EXECUTION",
      "name": "Provider Execution",
      "user_value": "Users can see when a provider-backed action is only a controlled candidate and cannot be confused with production execution.",
      "first_version": "v8.5.0",
      "status": "improved"
    },
    {
      "capability_id": "PCAP-PROVIDER-INCIDENT-RECOVERY",
      "name": "Provider Incident Recovery",
      "user_value": "Users can inspect what happens if a provider-backed action fails before allowing the action to advance.",
      "first_version": "v9.5.0",
      "status": "available"
    },
    {
      "capability_id": "PCAP-PROVIDER-COST-QUOTA",
      "name": "Provider Cost/Quota Boundary",
      "user_value": "Users can see whether provider-backed execution is allowed to spend tokens, calls, quota, or money before execution advances.",
      "first_version": "v9.6.0",
      "status": "available"
    },
    {
      "capability_id": "PCAP-ROLLBACK",
      "name": "Rollback",
      "user_value": "Users can avoid treating an external operation as acceptable when reversal evidence is missing.",
      "first_version": "v8.8.0",
      "status": "available"
    },
    {
      "capability_id": "PCAP-LEARNING",
      "name": "Learning",
      "user_value": "Users can make the next decision depend on what happened, rather than losing feedback after release.",
      "first_version": "v8.9.0",
      "status": "available"
    },
    {
      "capability_id": "PCAP-PRODUCT-VALUE-COMPREHENSION",
      "name": "Product Value Comprehension",
      "user_value": "Users do not need to infer release value from records, audits, schemas, or dashboard existence.",
      "first_version": "v9.1.0",
      "status": "improved"
    },
    {
      "capability_id": "PCAP-CAPABILITY-FIRST-RELEASE",
      "name": "Capability-First Release",
      "user_value": "Users can understand what changed in a release within 30 seconds before reading implementation details.",
      "first_version": "v9.3.0",
      "status": "available"
    },
    {
      "capability_id": "PCAP-ARCHMAP-LIFECYCLE-TRACEABILITY",
      "name": "Archmap Lifecycle Traceability",
      "user_value": "Users can inspect where architecture and work evidence fit in the lifecycle view instead of manually connecting separate AOF artifacts.",
      "first_version": "v9.7.0",
      "status": "available"
    },
    {
      "capability_id": "PCAP-PRODUCTION-GONOGO",
      "name": "Production Go/No-Go Evidence",
      "user_value": "Users can make a production-readiness judgment from one evidence surface instead of manually assembling approval, reproduction, rollback, outcome, incident, and cost/quota records.",
      "first_version": "v9.8.0",
      "status": "available"
    },
    {
      "capability_id": "PCAP-PRODUCTION-READINESS-REVIEW",
      "name": "Production Readiness Review",
      "user_value": "Operators can decide what is missing before production movement without reading every provider artifact manually.",
      "first_version": "v9.9.0",
      "status": "available"
    },
    {
      "capability_id": "PCAP-EXTERNAL-RUNTIME-PRODUCTIZATION",
      "name": "External Runtime Productization Decision",
      "user_value": "Operators can distinguish productization readiness from live execution permission and know what validation remains.",
      "first_version": "v10.0.0",
      "status": "available"
    },
    {
      "capability_id": "PCAP-THIRD-PARTY-VALIDATION-CONTRACT",
      "name": "Third-Party Operator Validation Contract",
      "user_value": "Operators can see exactly what outside validation must prove and what remains unproven.",
      "first_version": "v10.1.0",
      "status": "available"
    },
    {
      "capability_id": "PCAP-EXTERNAL-PROVIDER-PILOT-SELECTION",
      "name": "External Provider Pilot Selection",
      "user_value": "Operators can understand which provider AOF should pilot first and why, without mistaking selection for integration or execution.",
      "first_version": "v10.2.0",
      "status": "available"
    },
    {
      "capability_id": "PCAP-PRODUCTION-EXECUTION-AUTHORIZATION-MODEL",
      "name": "Production Execution Authorization Model",
      "user_value": "Operators can block unsafe live provider actions until every required authorization gate exists and is reviewed.",
      "first_version": "v10.3.0",
      "status": "available"
    },
    {
      "capability_id": "PCAP-EXTERNAL-VALUE-REPRODUCTION-PACKAGE",
      "name": "External Value Reproduction Evidence Package",
      "user_value": "Operators can test AOF value outside self-hosting without mistaking internal artifacts for external proof.",
      "first_version": "v10.4.0",
      "status": "available"
    },
    {
      "capability_id": "PCAP-PROVIDER-BACKED-WORK-LIFECYCLE-SURFACE",
      "name": "Provider-Backed Work Lifecycle Product Surface",
      "user_value": "Operators can understand provider-backed work without stitching raw artifacts together.",
      "first_version": "v10.5.0",
      "status": "available"
    },
    {
      "capability_id": "PCAP-THIRD-PARTY-VALIDATION-RESULT-INGESTION",
      "name": "Third-Party Validation Result Ingestion",
      "user_value": "Operators can turn external reviewer feedback into traceable governance evidence without treating it as automatic approval.",
      "first_version": "v10.6.0",
      "status": "available"
    },
    {
      "capability_id": "PCAP-CAPABILITY-COVERAGE-GATE",
      "name": "Capability Coverage Gate",
      "user_value": "Operators can catch missing specialists before build instead of discovering role/skill gaps during playtest or release review.",
      "first_version": "v10.7.0",
      "status": "available"
    },
    {
      "capability_id": "PCAP-ROLE-ROUTING-FAIL-CLOSED",
      "name": "Role Routing Fail-Closed Runtime",
      "user_value": "Operators can require domain specialists such as Game Planner, UX, Level Designer, or QA and trust AOF not to silently skip them.",
      "first_version": "v10.8.0",
      "status": "available"
    },
    {
      "capability_id": "PCAP-PROVIDER-PILOT-EXECUTION-READINESS",
      "name": "Provider Pilot Execution Readiness",
      "user_value": "Operators can decide whether a provider-backed pilot is structurally ready to advance without confusing readiness with live provider execution permission.",
      "first_version": "v10.9.0",
      "status": "available"
    },
    {
      "capability_id": "PCAP-GITHUB-READONLY-OBSERVATION-PROOF",
      "name": "GitHub Read-Only Observation Proof",
      "user_value": "Operators can ask what should happen next and receive a concrete Japanese answer grounded in GitHub state without granting write authority.",
      "first_version": "v11.0.0",
      "status": "available"
    },
    {
      "capability_id": "PCAP-EXTERNAL-OPERATOR-REPRODUCTION-PROOF",
      "name": "External Operator Reproduction Proof",
      "user_value": "Operators can decide whether AOF's next-task judgment is acceptable without reading the entire repository or asking the AI to explain again.",
      "first_version": "v11.1.0",
      "status": "available"
    }
  ],
  "deltas": [
    {
      "delta_id": "CRD-TASK-132-V111",
      "release_version": "11.1.0",
      "one_minute_value_explanation": "AOF can now turn its next-task judgment into a bounded Japanese reproduction drill: what is happening, what options exist, which task is selected, why it matters, what evidence to check, whether to proceed, and what the human should do next.",
      "thirty_second_version_delta": "v11.0 let AOF observe GitHub read-only and select a task; v11.1 makes that decision reproducible by a first-time or external operator within five minutes.",
      "new_capability_ids": [
        "PCAP-EXTERNAL-OPERATOR-REPRODUCTION-PROOF"
      ],
      "updated_capability_ids": [],
      "removed_capability_ids": [],
      "artifact_ref": ".aof/artifacts/capability-release-deltas/CRD-TASK-132-V111.json"
    }
  ],
  "checks": [
    {
      "name": "active release manifest presence",
      "status": "pass",
      "detail": "11.1.0",
      "evidence_refs": []
    },
    {
      "name": "product capability register presence",